{
  "projectName": "Untitled Miguel Design OS Project",
  "selectedConceptId": "",
  "approvalStatus": "pending",
  "approvedBy": "",
  "approvalNotes": "",
  "concepts": [
    {
      "id": "safe-expected",
      "name": "Safe Expected Direction",
      "visualMetaphor": "A clear product-specific metaphor that avoids generic dashboard defaults.",
      "composition": "Describe the first-screen structure, spatial hierarchy, and primary zones.",
      "focalObject": "Name the object that dominates the first viewport.",
      "emotionalHook": "Explain why the user should care before details appear.",
      "whatIsHidden": "List dense details hidden until after the first meaningful action.",
      "whatIsAbsent": "List cliches, extra panels, badges, or noise intentionally excluded.",
      "clicheAvoidance": "Name the obvious theme route and how this concept avoids it.",
      "desireMechanism": "Explain what makes the primary object desirable to choose or inspect.",
      "desktop1440Strategy": "Explain how the composition uses wide space without scale inflation.",
      "tablet768Strategy": "Explain the tablet layout and what collapses or reflows.",
      "mobile390Strategy": "Explain the mobile first viewport, primary object, and action.",
      "failureMode": "Name what would make this concept fail."
    },
    {
      "id": "art-directed",
      "name": "More Original Art-Directed Direction",
      "visualMetaphor": "A stronger, less obvious metaphor tied to the product's core action.",
      "composition": "Describe the staged or object-led composition.",
      "focalObject": "Name the dominant object, scene, or comparison moment.",
      "emotionalHook": "Explain the mood or desire created before details.",
      "whatIsHidden": "List information deferred until selection or inspection.",
      "whatIsAbsent": "List expected app-builder tropes intentionally removed.",
      "clicheAvoidance": "Explain how it avoids obvious AI slop or genre literalism.",
      "desireMechanism": "Explain the visual or interaction reward that makes users click.",
      "desktop1440Strategy": "Explain the desktop composition and supporting context.",
      "tablet768Strategy": "Explain the tablet structure and preserved focal object.",
      "mobile390Strategy": "Explain the mobile stack and no-horizontal-scroll plan.",
      "failureMode": "Name the risk that would collapse this into generic UI."
    },
    {
      "id": "wild-controlled",
      "name": "Wild But Controlled Direction",
      "visualMetaphor": "A bold metaphor that still serves the product rather than decoration.",
      "composition": "Describe the most differentiated first-screen layout.",
      "focalObject": "Name the object or scene that carries the concept.",
      "emotionalHook": "Explain the strongest desired reaction.",
      "whatIsHidden": "List technical or secondary content hidden initially.",
      "whatIsAbsent": "List safe/generic conventions intentionally absent.",
      "clicheAvoidance": "Explain how boldness avoids theme cliche and badge soup.",
      "desireMechanism": "Explain how hover, selection, or reveal creates reward.",
      "desktop1440Strategy": "Explain the wide-screen drama without attacking the user with scale.",
      "tablet768Strategy": "Explain the tablet composition and interaction.",
      "mobile390Strategy": "Explain the mobile crop, primary action, and readable zones.",
      "failureMode": "Name what would make the concept too noisy, childish, or unclear."
    }
  ]
}
